text,label
"mesmo que as vezes Manuela é amigável, Manuela é muito tímida",0
Cícero era confiável,1
"Severino parece ser ponderado, mas eu não sei",2
"Gino parece ser ousado, mas eu não sei",2
"Guilhermino parece ser vigarista, mas eu não sei",2
Vicêncio é esmerado,1
"Aniceto parece ser sossegado, mas eu não sei",2
"Nice é aventureira, mas as vezes ele parece ser cínica",1
Isaí não é diligente nem desequilibrado,2
Pilar sempre foi oportunista,0
Adélia sempre foi genuína,1
Elis sempre foi simpática,1
Moisés era intolerante,0
Helena sempre foi nervosa,0
Valentina nunca foi criativa,2
Albano é debochado,0
"Clídio parece ser distraído, mas eu não sei",2
Betina sempre foi mesquinha,0
Geórgia é tanto zelosa quanto vigarista,2
Jónatas era descomedido,0
"Franklino parece ser prestativo, mas eu não sei",2
"Helena é eficiente, mas as vezes ele parece ser desordeira",1
Maitê nunca foi teimosa,2
Modesto é otimista,1
Rodrigo era desequilibrado,0
Amanda sempre foi autoritária,0
Lívia nunca foi modesta,2
Arcélio é vigarista,0
Primitivo não é companheiro nem irritadiço,2
Adelindo não é tranquilo nem vaidoso,2
Didaco era divertido,1
"mesmo que as vezes Sara é prudente, Sara é muito desmotivada",0
Dieter era sensato,1
Aquiles é antipático,0
Pilar é tanto pacata quanto desafiador,2
Ismael era preconceituoso,0
Clarisse sempre foi rude,0
Bertoldo era fraco,0
Laura é tanto solidária quanto nervosa,2
Prudêncio é aventureiro,1
Evaldo é engraçado,1
Ademir era extraordinário,1
Cassiano é extraordinário,1
Maria sempre foi imparcial,1
Divo era pedante,0
Josefino é injusto,0
Ticiano era racional,1
"Júnior parece ser vigarista, mas eu não sei",2
Aubri não é aplicado nem instável,2
Isabela sempre foi estourada,0
Alivar é desequilibrado,0
Sisínio não é leal nem arrogante,2
Carolina nunca foi pedante,2
Jovito era empenhado,1
Aurora nunca foi transparente,2
Laura sempre foi ponderada,1
Ana sempre foi rude,0
Nicole sempre foi desmazelada,0
Constâncio é atrevido,0
Natalino é cínico,0
"mesmo que as vezes Clara é digna, Clara é muito rigorosa",0
Ovídio não é sagaz nem fútil,2
Edmundo não é valoroso nem impostor,2
Eder é brioso,1
Laura sempre foi solidária,1
"mesmo que as vezes Angelina é pacata, Angelina é muito depressiva",0
Jorge era sincero,1
Taís sempre foi introvertida,0
Estela nunca foi legal,2
"Rogélio parece ser simpático, mas eu não sei",2
Virgínia nunca foi cínica,2
"mesmo que as vezes Pilar é esforçada, Pilar é muito birrenta",0
Alice nunca foi egoísta,2
"Cecília é livre , mas as vezes ele parece ser grosseira",1
Antonela sempre foi impetuosa,0
Vílmar é amável,1
"Ernâni parece ser inseguro, mas eu não sei",2
"mesmo que as vezes Anabela é extraordinária, Anabela é muito descomedida",0
Nicole é tanto esplêndida quanto dissimulada,2
Manuela nunca foi vagabunda,2
Râdamas era descontraído,1
Virgínia nunca foi desmotivada,2
Mirela nunca foi organizada,2
Taís nunca foi falsa,2
Betina sempre foi íntegra,1
Rivelino era frio,0
"mesmo que as vezes Betina é sossegada, Betina é muito fria",0
Olindo era determinado,1
"Lauriano parece ser decoroso, mas eu não sei",2
"Querubim parece ser injusto, mas eu não sei",2
"Antonela é civilizada, mas as vezes ele parece ser indecisa",1
Ludovico é traidor,0
"mesmo que as vezes Guilhermina é confiável, Guilhermina é muito impostor",0
Eduardo não é caritativo nem desleixado,2
Alice é tanto preocupada quanto quezilenta,2
"mesmo que as vezes Elis é eficiente, Elis é muito mentirosa",0
Acílio é ganancioso,0
Nicole sempre foi esplêndida,1
Remígio é paciente,1
Teodósio era preconceituoso,0
Teobaldo não é bacana nem ansioso,2
Teodora sempre foi desordeira,0
Zaqueu não é racional nem agressivo,2
Mariana sempre foi atrevida,0
Rosário não é escrupuloso nem indelicado,2
Dieter era escrupuloso,1
Grácio era discriminador,0
Urias era atento,1
"Próspero parece ser irrequieto, mas eu não sei",2
"Manuela é meiga, mas as vezes ele parece ser mesquinha",1
Lucas é tolerante,1
Seleso não é companheiro nem fútil,2
Leonel é desbocado,0
Fradique não é cuidadoso nem precipitado,2
Pilar nunca foi amigável,2
Serafim é preconceituoso,0
Venceslau é gentil,1
"Valentino parece ser malandro, mas eu não sei",2
"Lara é ousada, mas as vezes ele parece ser introvertida",1
"mesmo que as vezes Lara é paciente, Lara é muito impiedosa",0
Sofia sempre foi insuportável,0
Teodora sempre foi vulnerável,0
Antonela sempre foi afável,1
Amália sempre foi adorável,1
Luísa sempre foi sensível,1
Feliz era odioso,0
Simão não é sagaz nem vaidoso,2
Leal é bruto,0
Nice sempre foi mandãa,0
"mesmo que as vezes Lara é habilidosa, Lara é muito ansiosa",0
Máximo é compreensivo,1
Berardo era cuidadoso,1
"mesmo que as vezes Clarisse é eloquente, Clarisse é muito mandãa",0
"Laura é engraçada, mas as vezes ele parece ser instável",1
Betina é tanto organizada quanto trocista,2
Gerardo é tranquilo,1
Fidélio era bruto,0
"Virgínia é ponderada, mas as vezes ele parece ser negligente",1
Ribca não é empreendedor nem desafiador,2
Guilherme era sedentário,0
Zózimo é pacato,1
Beatriz nunca foi cavalheira,2
Décimo não é cuidadoso nem frio,2
Áquila é forte,1
"Vânio parece ser curioso, mas eu não sei",2
Sebastião não é fiel nem insuportável,2
Azélio não é habilidoso nem cruel,2
"Marília é inventiva, mas as vezes ele parece ser fingida",1
Afonso é inconstante,0
Luísa sempre foi prestativa,1
Berardo não é corajoso nem bruto,2
Silas era distraído,0
Sávio é honroso,1
Sofia nunca foi atenciosa,2
"mesmo que as vezes Nice é gentil, Nice é muito mandãa",0
Estela sempre foi assertiva,1
Geórgia sempre foi desordeira,0
"Adosindo parece ser determinado, mas eu não sei",2
Maximiliano é comodista,0
Angélico era inflexível,0
Simplício era idôneo,1
"Aubri parece ser trocista, mas eu não sei",2
Virgínio é birrento,0
Geórgia sempre foi disponível,1
Helena sempre foi adorável,1
Benjamim é desumano,0
"mesmo que as vezes Nice é independente, Nice é muito descortês",0
Marlon não é agradável nem desafiador,2
Damasceno não é preocupado nem birrento,2
Estela é tanto entusiasta quanto rancorosa,2
Esmeraldo é adorável,1
Isabela nunca foi bisbilhoteira,2
Luzio é desleal,0
"Ladislau parece ser leal, mas eu não sei",2
"Estela é caritativa, mas as vezes ele parece ser negligente",1
Hermínio é diligente,1
Lineu é estourado,0
"Maria é inventiva, mas as vezes ele parece ser irrascível",1
Heloísa sempre foi gananciosa,0
Laurindo não é leal nem vaidoso,2
Alberto é grosso,0
"mesmo que as vezes Anabela é produtiva, Anabela é muito exigente",0
Marcelo era cívico,1
"Abílio parece ser decente, mas eu não sei",2
Carlos é ajuizado,1
Reno era colérico,0
Ódin é pessimista,0
"mesmo que as vezes Marília é assertiva, Marília é muito injusta",0
"Russel parece ser trocista, mas eu não sei",2
Heloísa sempre foi depressiva,0
Valentina é tanto disponível quanto impertinente,2
Falcão é indiferente,0
Lara sempre foi engraçada,1
Otelo era frívolo,0
Guilhermina sempre foi pacata,1
Quéli é livre ,1
Manuela sempre foi eloquente,1
Teodora sempre foi doce,1
Lívia nunca foi descarada,2
Maria é tanto compreensiva quanto depressiva,2
Constâncio não é humanitário nem injusto,2
"Júlia é cuidadosa, mas as vezes ele parece ser desumana",1
"Brandão parece ser discriminador, mas eu não sei",2
Berilo é cruel,0
Lara nunca foi desonesta,2
Úrsula nunca foi sarcástica,2
"Romarigo parece ser pontual, mas eu não sei",2
"mesmo que as vezes Cecília é diligente, Cecília é muito insincera",0
"Estéfano parece ser frio, mas eu não sei",2
"Catarina é meiga, mas as vezes ele parece ser avarenta",1
"Rosário parece ser valente, mas eu não sei",2
Isaac era brioso,1
"Isadora é atenciosa, mas as vezes ele parece ser desonesta",1
"Eli parece ser comunicativo, mas eu não sei",2
Catarina nunca foi justa,2
Lara é tanto sábia quanto impertinente,2
Adriano era desbocado,0
Sara é tanto criteriosa quanto vagabunda,2
"Falcão parece ser zeloso, mas eu não sei",2
Edir é negligente,0
Getúlio era meigo,1
Amanda sempre foi trocista,0
Élsio era tranquilo,1
Anselmo era criativo,1
Constantino é excelente,1
Norberto não é amável nem irracional,2
Cíntio era perspicaz,1
Júlia é tanto produtiva quanto nervosa,2
Luísa sempre foi honesta,1
Sancho é quezilento,0
Cildo era rancoroso,0
"Valério parece ser benévolo, mas eu não sei",2
Tadeu era altruísta,1
Estela nunca foi ponderada,2
"Aquil parece ser solidário, mas eu não sei",2
Estela é tanto valorosa quanto impiedosa,2
Amália sempre foi generosa,1
Rói era amável,1
Nicola era bacana,1
Tude é oportunista,0
Elvino era sarcástico,0
Guilhermina sempre foi antipática,0
"Anísio parece ser malandro, mas eu não sei",2
Valgi era traidor,0
Teodora é tanto honesta quanto desmotivada,2
"mesmo que as vezes Nice é maravilhosa, Nice é muito pessimista",0
Bárbaro é frívolo,0
"mesmo que as vezes Alice é corajosa, Alice é muito desconfiada",0
Honorato é entusiasta,1
Rolando era maravilhoso,1
Eunice é tanto honrosa quanto imprudente,2
Aléxio é imponderado,0
Doralice sempre foi mesquinha,0
Úrsula sempre foi assertiva,1
Sofia sempre foi cruel,0
Clarisse sempre foi valente,1
"Maria é escrupulosa, mas as vezes ele parece ser narcisista",1
Dora nunca foi malandra,2
Valentina nunca foi inconveniente,2
Maximiliano era ousado,1
Sisnando não é carinhoso nem debochado,2
Alarico não é fofo nem desbocado,2
Elis nunca foi oportunista,2
Egas era persistente,1
"mesmo que as vezes Júlia é divertida, Júlia é muito grossa",0
"Alexandre parece ser rigoroso, mas eu não sei",2
"mesmo que as vezes Lis é preocupada, Lis é muito agressiva",0
Valério não é observador nem descomedido,2
Lívia sempre foi zelosa,1
Valentina é tanto meiga quanto despótica,2
Doralice sempre foi carinhosa,1
"mesmo que as vezes Amália é observador, Amália é muito desleixada",0
Helena sempre foi atenta,1
Patrício era rancoroso,0
Elis sempre foi presunçosa,0
"Sara é esforçada, mas as vezes ele parece ser desleal",1
Guilhermina nunca foi fraca,2
Heloísa sempre foi introvertida,0
Clésio era preparado,1
Olívia nunca foi preguiçosa,2
"Beatriz é amável, mas as vezes ele parece ser indiferente",1
"Cecília é verdadeira, mas as vezes ele parece ser fria",1
Pracídio é sábio,1
Wermeson não é habilidoso nem hipócrita,2
"mesmo que as vezes Teodora é livre , Teodora é muito grossa",0
Niete é respeitador,1
Liliano era calculista,0
Alice é tanto respeitador quanto prepotente,2
"Benício parece ser empático, mas eu não sei",2
Herédio era gentil,1
"mesmo que as vezes Doralice é pacata, Doralice é muito calculista",0
"Catarina é proativa, mas as vezes ele parece ser impostor",1
Ana é tanto tolerante quanto sarcástica,2
Damasceno não é perspicaz nem mentiroso,2
"Mauro parece ser antipático, mas eu não sei",2
"Hélvio parece ser livre , mas eu não sei",2
"Fabrício parece ser honesto, mas eu não sei",2
Mariana sempre foi natural,1
Bento era inflexível,0
Lauriano não é legal nem irresponsável,2
Manuela sempre foi distraída,0
Willy era rude,0
"Manuela é honrada, mas as vezes ele parece ser vaidosa",1
Evelásio era desbocado,0
Venâncio é covarde,0
"mesmo que as vezes Dora é pontual, Dora é muito ignorante",0
Aubri é confiável,1
"mesmo que as vezes Teodora é caritativa, Teodora é muito depressiva",0
Orlandino é maravilhoso,1
Oto é descomedido,0
Manuela sempre foi organizada,1
"Vilar parece ser agradável, mas eu não sei",2
Aleu é impertinente,0
Brandão é esforçado,1
Guadalberto era impostor,0
Atanásio era livre ,1
"Valentina é feliz, mas as vezes ele parece ser maliciosa",1
Aprígio era eficiente,1
Requerino era sedentário,0
"Carolina é aplicada, mas as vezes ele parece ser mentirosa",1
Mirela sempre foi desequilibrada,0
Alípio é esmerado,1
Pompeu era brioso,1
Verdi é pessimista,0
Charbel era medroso,0
Adão não é justo nem vagabundo,2
Florentino não é credível nem malvado,2
Marlon é tolerante,1
"Elzeário parece ser gentil, mas eu não sei",2
Rigoberto é exigente,0
Isabela sempre foi malvada,0
Próspero é manhoso,0
Angelina sempre foi casmurra,0
Alcides é antipático,0
Zalman era indecoroso,0
Nina é tanto criativa quanto bruta,2
"mesmo que as vezes Clarisse é livre , Clarisse é muito desumana",0
Martiniano é dedicado,1
Laurénio não é esmerado nem discriminador,2
Herculano não é maduro nem vigarista,2
Olívia sempre foi irrequieta,0
Noé é xenófobo,0
Jovelino é brioso,1
Bastião era incorreto,0
Sara sempre foi tendenciosa,0
Alvarino é descarado,0
Teodora sempre foi negligente,0
"Baptista parece ser discriminador, mas eu não sei",2
Augusto não é companheiro nem nervoso,2
"Marcelino parece ser prepotente, mas eu não sei",2
"Anacleto parece ser hipócrita, mas eu não sei",2
Elisa sempre foi amável,1
Rúdi é calculista,0
Aurora sempre foi desleixada,0
"mesmo que as vezes Taís é ajuizada, Taís é muito cínica",0
Guilhermina sempre foi orgulhosa,0
Valentina sempre foi irrequieta,0
Betina é tanto agradável quanto fria,2
Lindorfo era rigoroso,0
Lis é tanto descontraída quanto dissimulada,2
Simauro não é prestativo nem egoísta,2
Amanda é tanto honesta quanto inconveniente,2
"mesmo que as vezes Berenice é idônea, Berenice é muito rigorosa",0
Januário era ansioso,0
Hermenegildo não é adorável nem crítico,2
"mesmo que as vezes Gisela é solidária, Gisela é muito grosseira",0
Amália sempre foi sábia,1
Clarisse sempre foi fraca,0
Eusébio é intransigente,0
Cecília é tanto maravilhosa quanto desafiador,2
Serafim era pontual,1
Ingo era consciencioso,1
Doralice sempre foi gananciosa,0
"Ibérico parece ser responsável, mas eu não sei",2
Arcílio é afetivo,1
Gonzaga é malicioso,0
Job é perseverante,1
Ana sempre foi tendenciosa,0
"Isadora é respeitador, mas as vezes ele parece ser trocista",1
Haroldo é honroso,1
Paloma é tanto pacata quanto discriminador,2
"Olívia é encantador, mas as vezes ele parece ser maldosa",1
Beatriz sempre foi fiel,1
Laurénio era empático,1
Beatriz sempre foi pedante,0
Jessé é atento,1
Lis é tanto madura quanto fraca,2
Laura é tanto perseverante quanto casmurra,2
Veríssimo é ajuizado,1
"Virgínia é meiga, mas as vezes ele parece ser ignorante",1
Celto era afável,1
Júlia sempre foi carinhosa,1
"mesmo que as vezes Betina é ponderada, Betina é muito instável",0
"Sofia é atenciosa, mas as vezes ele parece ser trocista",1
Pepe era indelicado,0
Valentina nunca foi solidária,2
Nabor é calmo,1
"mesmo que as vezes Catarina é atenciosa, Catarina é muito introvertida",0
Dener é criterioso,1
"mesmo que as vezes Paloma é genuína, Paloma é muito estourada",0
Maria é tanto gentil quanto interesseira,2
Teodósio é sagaz,1
Amália nunca foi rude,2
Isolino é pedante,0
Anselmo era traiçoeiro,0
Laura sempre foi disponível,1
Arlindo é desafiador,0
Antônia é tanto nobre quanto impostor,2
Amália sempre foi negligente,0
Valente não é legal nem autoritário,2
Doralice sempre foi sedentária,0
Nina é tanto afetiva quanto orgulhosa,2
Valentina sempre foi bondosa,1
Beatriz é tanto proativa quanto descomedida,2
Átila é grosseiro,0
"Pilar é cívica, mas as vezes ele parece ser obcecada",1
Luís Figo é forte,1
Severiano é perfeccionista,1
Berenice é tanto generosa quanto arrogante,2
"Rai parece ser vigarista, mas eu não sei",2
Bartolomeu não é desenvolto nem traiçoeiro,2
Aleu é desleal,0
Fernando é impertinente,0
Celino era feliz,1
Brás era valoroso,1
Pilar sempre foi mesquinha,0
Guilhermina nunca foi ajuizada,2
Francisco era irracional,0
Elói era manhoso,0
"Sofia é prestativa, mas as vezes ele parece ser depressiva",1
Sindulfo não é paciente nem casmurro,2
Mirela nunca foi medrosa,2
"mesmo que as vezes Manuela é credível, Manuela é muito vulnerável",0
"Laertes parece ser rude, mas eu não sei",2
Luca é hipócrita,0
Clarisse é tanto habilidosa quanto inflexível,2
Isabela nunca foi proativa,2
"Pilar é fofa, mas as vezes ele parece ser irresponsável",1
"Mariana é generosa, mas as vezes ele parece ser tímida",1
Dino era descortês,0
Mariana sempre foi fraca,0
Manuela sempre foi imponderada,0
Césaro não é decente nem ganancioso,2
Valentina sempre foi calculista,0
"Azuil parece ser perspicaz, mas eu não sei",2
Susano é inteligente,1
"Luísa é pontual, mas as vezes ele parece ser fria",1
Anabela sempre foi fútil,0
Dulcínio era divertido,1
Helena nunca foi maravilhosa,2
Sara é tanto racional quanto desconfiada,2
Parcídio não é corajoso nem apático,2
Amanda é tanto assertiva quanto egoísta,2
Jório é bondoso,1
Mariana nunca foi aventureira,2
Élson era otimista,1
"mesmo que as vezes Valentina é amável, Valentina é muito inflexível",0
Valentina sempre foi entusiasta,1
"Helena é solidária, mas as vezes ele parece ser gananciosa",1
"Salomão parece ser desordeiro, mas eu não sei",2
Olívia sempre foi observador,1
Everaldo era impetuoso,0
Antônia é tanto aventureira quanto fútil,2
Isadora nunca foi descortês,2
Aldaír não é pontual nem indeciso,2
Heloísa nunca foi avarenta,2
"Eunice é dedicada, mas as vezes ele parece ser desmotivada",1
Nice sempre foi desmazelada,0
"mesmo que as vezes Eunice é feliz, Eunice é muito instável",0
Selésio é sarcástico,0
Línton era impiedoso,0
"Zafriel parece ser xenófobo, mas eu não sei",2
"mesmo que as vezes Taís é justa, Taís é muito obcecada",0
Dinis é empreendedor,1
Abelardo é gentil,1
Isaque era preocupado,1
Dora sempre foi vaidosa,0
"Soeiro parece ser descomedido, mas eu não sei",2
Marto era curioso,1
Gávio era bondoso,1
Ragendra era discriminador,0
Carolina sempre foi fingida,0
Hélio era casmurro,0
Eduartino é indecoroso,0
"Eric parece ser comunicativo, mas eu não sei",2
"Vicente parece ser impulsivo, mas eu não sei",2
Estela nunca foi doce,2
Clésio era pacato,1
Jeremias era justo,1
Amália é tanto solidária quanto desequilibrada,2
"Francisco parece ser presunçoso, mas eu não sei",2
Olívia nunca foi prestativa,2
"Severino parece ser grosseiro, mas eu não sei",2
Lívia sempre foi injusta,0
Bernardim era extrovertido,1
Habacuc não é paciente nem presunçoso,2
Estela é tanto perseverante quanto indelicada,2
Maitê sempre foi perspicaz,1
Berilo era cordial,1
Bendavid é zeloso,1
Maitê nunca foi afável,2
Severo não é transparente nem hipócrita,2
Máximo era tendencioso,0
Ana sempre foi desonesta,0
Eunice nunca foi mesquinha,2
Durvalino é desumano,0
Gualdim é prepotente,0
Anabela nunca foi nobre,2
Marília nunca foi empática,2
Lis sempre foi infiel,0
"mesmo que as vezes Isadora é otimista, Isadora é muito descomedida",0
Marília sempre foi desonesta,0
Delfino é natural,1
Afonso é crítico,0
Lis é tanto ajuizada quanto neurótica,2
Vidal não é idôneo nem rude,2
"mesmo que as vezes Ana é adorável, Ana é muito debochada",0
Leonel é mandão,0
Adruzilo era assertivo,1
Leónidas é comunicativo,1
"Lara é bacana, mas as vezes ele parece ser cínica",1
Heloísa sempre foi confiante,1
Severo é inovador,1
Marinho não é digno nem intolerante,2
Celino era doce,1
Isadora sempre foi inconveniente,0
Procópio não é pontual nem avarento,2
Assis era medroso,0
"Bebiano parece ser preocupado, mas eu não sei",2
Gisela nunca foi ajuizada,2
"Lis é franca, mas as vezes ele parece ser intransigente",1
Cecília sempre foi confiável,1
Luzio era instável,0
"Martiniano parece ser afetivo, mas eu não sei",2
Genésio era rigoroso,0
Paloma sempre foi bondosa,1
Mamede era meigo,1
Nói era sensato,1
Iúri é criativo,1
Isaltino não é bacana nem desbocado,2
Nenrode é egoísta,0
Sadrudine é medroso,0
Micael de Jesus é preconceituoso,0
"Ian parece ser nervoso, mas eu não sei",2
Horácio não é dedicado nem maldoso,2
Alice sempre foi cavalheira,1
Teresa sempre foi orgulhosa,0
"Estela é amável, mas as vezes ele parece ser intolerante",1
Estêvão não é civilizado nem depressivo,2
"Amanda é conscienciosa, mas as vezes ele parece ser infiel",1
Estela sempre foi amorosa,1
Heloísa é tanto esplêndida quanto incorreta,2
"mesmo que as vezes Antonela é briosa, Antonela é muito nervosa",0
Úrsula é tanto cívica quanto instável,2
Manuela nunca foi inflexível,2
Sofia é tanto natural quanto avarenta,2
Beatriz é tanto determinada quanto indiferente,2
Nicole é tanto escrupulosa quanto frívola,2
Aleu não é dedicado nem irritadiço,2
"mesmo que as vezes Elisa é esperançosa, Elisa é muito desbocada",0
Nembrode é fútil,0
"Sales parece ser sossegado, mas eu não sei",2
Antonela sempre foi racional,1
Estela sempre foi perspicaz,1
"Taís é leal, mas as vezes ele parece ser fraca",1
Helena sempre foi precipitada,0
Franklin era esforçado,1
Lourenço não é autêntico nem medroso,2
Egil não é valente nem hipócrita,2
Marília sempre foi xenófoba,0
Manuela sempre foi irracional,0
"Amanda é benévola, mas as vezes ele parece ser frívola",1
Elisa nunca foi teimosa,2
Paula é tanto descontraída quanto antipática,2
Anabela nunca foi decente,2
Roli é desleal,0
"Franclim parece ser orgulhoso, mas eu não sei",2
Helena nunca foi insuportável,2
Fradique é inflexível,0
Nicole é tanto proativa quanto irresponsável,2
Virgínia nunca foi apressada,2
"Lívia é verdadeira, mas as vezes ele parece ser antissocial",1
"Alano parece ser nobre, mas eu não sei",2
Kévim não é escrupuloso nem ignorante,2
"Clarisse é proativa, mas as vezes ele parece ser ciumenta",1
Beatriz nunca foi fiel,2
"Lara é entusiasta, mas as vezes ele parece ser descortês",1
Mirela sempre foi cínica,0
"Geórgia é educada, mas as vezes ele parece ser indecisa",1
Jociano era rabugento,0
Berto não é bacana nem inseguro,2
Geórgia nunca foi desmotivada,2
Elis sempre foi inventiva,1
"Quiliano parece ser trocista, mas eu não sei",2
Gino era inconveniente,0
Miqueias era precipitado,0
Doralice é tanto feliz quanto insensata,2
"mesmo que as vezes Gisela é encantador, Gisela é muito crítica",0
Bonifácio é manhoso,0
Edgar é inconveniente,0
"mesmo que as vezes Heloísa é cuidadosa, Heloísa é muito pedante",0
Domingos não é encantador nem exigente,2
Mirela sempre foi sensível,1
Sofia sempre foi orgulhosa,0
Beatriz sempre foi vigarista,0
Roli é bruto,0
Nina sempre foi cívica,1
Laura nunca foi desconfiada,2
"mesmo que as vezes Luísa é atenta, Luísa é muito prepotente",0
Isaac é sossegado,1
"mesmo que as vezes Berenice é decente, Berenice é muito presunçosa",0
Berenice sempre foi afável,1
Césaro era afável,1
Nazário é leal,1
Cursino era impaciente,0
Aurora nunca foi amorosa,2
"Estela é aplicada, mas as vezes ele parece ser depressiva",1
Janai era calmo,1
Arcanjo é vigarista,0
"Nil parece ser nervoso, mas eu não sei",2
Hérman não é livre  nem odioso,2
Amândio não é gentil nem apático,2
João é desobediente,0
"Taís é habilidosa, mas as vezes ele parece ser irrascível",1
Joabe era solícito,1
Secundino era bondoso,1
"Florival parece ser mandão, mas eu não sei",2
Eunice sempre foi confiável,1
Isidro era responsável,1
"Nélio parece ser neurótico, mas eu não sei",2
"mesmo que as vezes Cecília é cívica, Cecília é muito nervosa",0
Nicole nunca foi comodista,2
Eunice sempre foi prepotente,0
Eustáquio é ganancioso,0
Jacó era agressivo,0
Manuela é tanto racional quanto malvada,2
Estela sempre foi hipócrita,0
"Isadora é confiante, mas as vezes ele parece ser pessimista",1
Maximiliano é insincero,0
Romeu era fraco,0
Isadora sempre foi conscienciosa,1
Catarina sempre foi precipitada,0
Heloísa nunca foi vaidosa,2
"Felicíssimo parece ser pontual, mas eu não sei",2
Luísa nunca foi franca,2
Carolina sempre foi transparente,1
Ralfe é esforçado,1
Joabe é descontraído,1
Nina nunca foi sedentária,2
Pilar sempre foi amorosa,1
Vito era afetivo,1
Liberto era grosso,0
"mesmo que as vezes Angelina é confiável, Angelina é muito introvertida",0
Mem não é honrado nem chato,2
Edir era preconceituoso,0
Sinésio era maldoso,0
Hazael era traiçoeiro,0
Martiniano é incorreto,0
Hermes era empático,1
Evelásio é falso,0
"mesmo que as vezes Júlia é meiga, Júlia é muito desequilibrada",0
Leonora sempre foi educada,1
Idário era maduro,1
Helena sempre foi trapaceira,0
"mesmo que as vezes Amanda é ajuizada, Amanda é muito colérica",0
Laura é tanto cavalheira quanto desafiador,2
Patrício era benévolo,1
Africano não é altruísta nem comodista,2
Madjer é dedicado,1
Adélia sempre foi apressada,0
"Sócrates parece ser neurótico, mas eu não sei",2
Denil é alegre,1
"Bóris parece ser avarento, mas eu não sei",2
Ambrósio era fútil,0
Sofia nunca foi valente,2
Filinto não é racional nem possessivo,2
Pompeu era traidor,0
"Salviano parece ser vigarista, mas eu não sei",2
"mesmo que as vezes Ana é excelente, Ana é muito teimosa",0
Eurico não é organizado nem impetuoso,2
Betina sempre foi insegura,0
Milo é cínico,0
"Carolina é cavalheira, mas as vezes ele parece ser falsa",1
"Oto parece ser humanitário, mas eu não sei",2
Júlia nunca foi ponderada,2
Wermeson era descomedido,0
Aldemar era comodista,0
Mauri é calmo,1
Maurício não é excelente nem frio,2
Gisela sempre foi desafiador,0
Manuela é tanto diligente quanto birrenta,2
Taís é tanto esplêndida quanto trocista,2
Paula nunca foi insincera,2
"mesmo que as vezes Teodora é disponível, Teodora é muito desconfiada",0
Mariana sempre foi maquiavélica,0
"Clarisse é transparente, mas as vezes ele parece ser depressiva",1
Cecília nunca foi ponderada,2
Délcio era desobediente,0
Lis é tanto inteligente quanto desconfiada,2
"Carlo parece ser pacato, mas eu não sei",2
Clara é tanto encantador quanto desordeira,2
"Estela é sensível, mas as vezes ele parece ser obcecada",1
Aron é ciumento,0
Ermitério é maldoso,0
"Antônia é respeitador, mas as vezes ele parece ser exigente",1
Geórgia sempre foi solidária,1
Sávio é imprudente,0
