text,label
Júnior era decente,1
"Antonela é pontual, mas as vezes ele parece ser fria",1
Maria sempre foi insuportável,0
"mesmo que as vezes Sofia é agradável, Sofia é muito ignorante",0
Celso era carinhoso,1
Marcelino era prepotente,0
"Acílio parece ser ousado, mas eu não sei",2
Helena sempre foi infiel,0
Isadora é tanto nobre quanto prepotente,2
Sacramento era pontual,1
"mesmo que as vezes Paula é preocupada, Paula é muito mesquinha",0
Gisela sempre foi feliz,1
"Maximino parece ser bisbilhoteiro, mas eu não sei",2
Clídio era covarde,0
Brígido não é confiável nem maquiavélico,2
Alcibíades era descarado,0
Luísa sempre foi corajosa,1
Berenice sempre foi desbocada,0
Teresa sempre foi grossa,0
Quirilo é perspicaz,1
"Adélia é ousada, mas as vezes ele parece ser negligente",1
Virgínia sempre foi descontraída,1
César é odioso,0
"Martim parece ser inflexível, mas eu não sei",2
"Geórgia é racional, mas as vezes ele parece ser bruta",1
Carolina sempre foi esplêndida,1
Absalão é impiedoso,0
Nina sempre foi organizada,1
Jório era desonesto,0
Betina sempre foi adorável,1
Maitê nunca foi bondosa,2
Janique era prestável,1
Fúlvio era legal,1
Nina nunca foi incompetente,2
Clara é tanto conscienciosa quanto cruel,2
Lívia é tanto ponderada quanto colérica,2
Édipo era altruísta,1
"Pascoal parece ser tendencioso, mas eu não sei",2
Delmar não é corajoso nem vigarista,2
Romarico não é companheiro nem impiedoso,2
Lourenço é leal,1
Aurora nunca foi briosa,2
Amanda sempre foi assertiva,1
"Elisa é alegre, mas as vezes ele parece ser intolerante",1
Antônia sempre foi decente,1
Plácido não é forte nem apressado,2
Salustiniano é assertivo,1
Virgínia é tanto feliz quanto possessiva,2
Angelina nunca foi orgulhosa,2
Nice sempre foi crítica,0
Mirela nunca foi birrenta,2
Pio é instável,0
Dora sempre foi rancorosa,0
Paula sempre foi infiel,0
"mesmo que as vezes Carolina é comunicativa, Carolina é muito irrequieta",0
Gilberto era indiferente,0
"Nilson parece ser observador, mas eu não sei",2
Aleu é verdadeiro,1
Yan é falso,0
Nicole é tanto extrovertida quanto desordeira,2
"mesmo que as vezes Nice é agradável, Nice é muito estressada",0
Catarina é tanto esmerada quanto vagabunda,2
Doralice sempre foi responsável,1
Eládio não é observador nem quezilento,2
Amanda é tanto esmerada quanto vulnerável,2
Elisa nunca foi desmotivada,2
"Adélia é natural, mas as vezes ele parece ser problemática",1
Joscelino não é afável nem quezilento,2
Jório era descortês,0
Aventino era medroso,0
Carolina sempre foi paciente,1
Mirela é tanto aplicada quanto ansiosa,2
Aquila é franco,1
"mesmo que as vezes Teodora é empática, Teodora é muito desconfiada",0
"Armando parece ser obcecado, mas eu não sei",2
Maria nunca foi honesta,2
Manuela sempre foi irracional,0
"Maitê é solícita, mas as vezes ele parece ser desobediente",1
Edo não é prestável nem estressado,2
Ana sempre foi incorreta,0
"Lis é habilidosa, mas as vezes ele parece ser rigorosa",1
Sara é tanto aplicada quanto grossa,2
Gustavo é inconveniente,0
Gerson não é humanitário nem orgulhoso,2
Teodora sempre foi estressada,0
Assis era prepotente,0
Agnes sempre foi irrequieta,0
Isabela sempre foi perseverante,1
"mesmo que as vezes Clara é otimista, Clara é muito incorreta",0
Brígido era intransigente,0
"Manuela é sensível, mas as vezes ele parece ser falsa",1
Abrão não é preocupado nem fútil,2
Mem é grosso,0
Úrsula sempre foi tranquila,1
Fernão é prestável,1
"Ivan parece ser valente, mas eu não sei",2
Anabela é tanto agradável quanto ciumenta,2
Oceano era empenhado,1
Isaltino é desleal,0
Olindo era engraçado,1
Marília é tanto meiga quanto rabugenta,2
Eunice sempre foi agradável,1
Susano era xenófobo,0
Yan não é observador nem covarde,2
"mesmo que as vezes Aurora é corajosa, Aurora é muito insuportável",0
Gisela sempre foi ponderada,1
Alice sempre foi desafiador,0
Dieter é fraco,0
Mátio não é decoroso nem fútil,2
"Elis é esperançosa, mas as vezes ele parece ser grossa",1
Estêvão é esplêndido,1
"Zarão parece ser traiçoeiro, mas eu não sei",2
"Isidro parece ser tranquilo, mas eu não sei",2
Amanda é tanto prudente quanto ignorante,2
Argemiro era possessivo,0
Elmano é arrogante,0
Anastácio não é empenhado nem narcisista,2
"Antonela é decorosa, mas as vezes ele parece ser desmotivada",1
"mesmo que as vezes Isadora é criteriosa, Isadora é muito mandãa",0
Otoniel era comodista,0
Guilhermina sempre foi exigente,0
Anabela sempre foi insegura,0
Leôncio era justo,1
Armando é infiel,0
Mirela sempre foi bruta,0
Nascimento não é credível nem descortês,2
Assis era fingido,0
"Catarina é decente, mas as vezes ele parece ser rigorosa",1
Teodemiro era nervoso,0
"Sansão parece ser traidor, mas eu não sei",2
Jasão é vigarista,0
Felício é estourado,0
Lívia sempre foi inteligente,1
"Evandro parece ser obcecado, mas eu não sei",2
Celto era insensato,0
"mesmo que as vezes Marília é amigável, Marília é muito frívola",0
"Oseias parece ser imprudente, mas eu não sei",2
"mesmo que as vezes Luísa é legal, Luísa é muito bruta",0
"Armelim parece ser desleixado, mas eu não sei",2
Hildebrando era irrascível,0
Mirela sempre foi credível,1
"Gascão parece ser rigoroso, mas eu não sei",2
Gisela nunca foi traidor,2
Heloísa sempre foi mesquinha,0
Yarin era confiável,1
Zalman era independente,1
Catarina nunca foi vulnerável,2
Leonora sempre foi intransigente,0
Teodora sempre foi solidária,1
Vicêncio era encantador,1
"Taís é educada, mas as vezes ele parece ser agressiva",1
Sotero não é ajuizado nem precipitado,2
Clemêncio é aventureiro,1
Afonso não é calmo nem desconfiado,2
Ivanoel era cuidadoso,1
"Clife parece ser tolerante, mas eu não sei",2
Gisela é tanto franca quanto fraca,2
"Vérter parece ser descontraído, mas eu não sei",2
"mesmo que as vezes Nina é livre , Nina é muito impaciente",0
Idalécio era generoso,1
Isadora é tanto solícita quanto ciumenta,2
Cipriano era cordial,1
Olívia sempre foi bisbilhoteira,0
Prado era confiante,1
Leonora é tanto cortês quanto insincera,2
Janai era honesto,1
Lauro é esmerado,1
Simauro é impulsivo,0
"Joabe parece ser indecoroso, mas eu não sei",2
"Domínico parece ser extraordinário, mas eu não sei",2
"Antonela é adorável, mas as vezes ele parece ser bruta",1
Alivar não é solícito nem pedante,2
Sifredo era chato,0
Hildegardo é irrequieto,0
Celísio é impulsivo,0
Baptista era descomedido,0
Zarco é atencioso,1
Didaco é impaciente,0
"mesmo que as vezes Dora é fofa, Dora é muito exigente",0
"mesmo que as vezes Mariana é valente, Mariana é muito introvertida",0
Principiano era imparcial,1
Mirela sempre foi extrovertida,1
Francisco era produtivo,1
Quaresma era debochado,0
Hermenegildo é malvado,0
Iag era indecoroso,0
Nídio era solícito,1
Lívia sempre foi calculista,0
Nói é neurótico,0
Munir era preguiçoso,0
Anania era neurótico,0
"Corsino parece ser egoísta, mas eu não sei",2
"Amália é comunicativa, mas as vezes ele parece ser desmazelada",1
Adosindo era teimoso,0
Priteche era gentil,1
Rogério é descontraído,1
Rúben era relapso,0
Venceslau era generoso,1
Demétrio é crítico,0
Júlia sempre foi cuidadosa,1
Susano não é determinado nem desmotivado,2
"Adalsindo parece ser irrascível, mas eu não sei",2
Arcádio não é valente nem calculista,2
Teresa sempre foi cínica,0
Aloísio não é prestável nem desonesto,2
Lindoro era desequilibrado,0
U era solícito,1
Alice é tanto carinhosa quanto rude,2
Pilar sempre foi narcisista,0
"Lívia é corajosa, mas as vezes ele parece ser tendenciosa",1
Pedrino era decoroso,1
"Aldónio parece ser esmerado, mas eu não sei",2
Décio era traidor,0
Lis nunca foi impiedosa,2
Pracídio é narcisista,0
"Marto parece ser impiedoso, mas eu não sei",2
"mesmo que as vezes Alice é solidária, Alice é muito infiel",0
Mariana nunca foi desumana,2
"Júnio parece ser cuidadoso, mas eu não sei",2
Amável era impulsivo,0
Vaíse é gentil,1
Márcio é estressado,0
Vianei é mentiroso,0
Durval era presunçoso,0
"mesmo que as vezes Heloísa é gentil, Heloísa é muito falsa",0
Laureano é manhoso,0
Nice é tanto descontraída quanto odiosa,2
Nicole é tanto simpática quanto rigorosa,2
"Doralice é respeitador, mas as vezes ele parece ser tendenciosa",1
Alan é dissimulado,0
"Maitê é doce, mas as vezes ele parece ser hipócrita",1
Nobre era bondoso,1
Décio era cavalheiro,1
Adélia sempre foi descortês,0
Helena nunca foi nobre,2
Antonela sempre foi indecorosa,0
Guilhermino era inteligente,1
Denis era antissocial,0
Amanda sempre foi irritadiça,0
Júlia nunca foi vagabunda,2
"Olegário parece ser sensato, mas eu não sei",2
Marco era credível,1
"mesmo que as vezes Geórgia é fiel, Geórgia é muito discriminador",0
"mesmo que as vezes Lis é fofa, Lis é muito desmotivada",0
Mesaque é inovador,1
Ramberto era prestável,1
Roriz era encantador,1
Abelâmio era impulsivo,0
Valentina nunca foi extrovertida,2
Ildo não é solidário nem intolerante,2
Remígio era frio,0
Secundino não é cuidadoso nem descarado,2
Elioenai não é sensível nem rigoroso,2
"Canto parece ser íntegro, mas eu não sei",2
Catarina é tanto livre  quanto fingida,2
Paula sempre foi fútil,0
Estela nunca foi precipitada,2
Nélio não é sossegado nem insincero,2
Agnes é tanto leal quanto infiel,2
Ari é amoroso,1
Dirque era indecoroso,0
"Teresa é verdadeira, mas as vezes ele parece ser estressada",1
Brígido não é companheiro nem irrequieto,2
Amanda sempre foi organizada,1
"Valentina é aplicada, mas as vezes ele parece ser irrequieta",1
Américo é íntegro,1
Geórgia é tanto aplicada quanto despótica,2
Nádege é prepotente,0
"mesmo que as vezes Gisela é observador, Gisela é muito indiferente",0
Cassiano era ternurento,1
Valgi não é preocupado nem indiferente,2
Cid era paciente,1
"Hildebrando parece ser inventivo, mas eu não sei",2
Manuela sempre foi amigável,1
"mesmo que as vezes Nicole é agradável, Nicole é muito medrosa",0
Analide é maquiavélico,0
Nicole sempre foi relapsa,0
Marília sempre foi nobre,1
Dora sempre foi generosa,1
Nicole sempre foi descortês,0
Maria sempre foi benévola,1
"Lis é perseverante, mas as vezes ele parece ser negligente",1
Gaudêncio não é honrado nem sedentário,2
"Ludgero parece ser simpático, mas eu não sei",2
Anabela sempre foi idônea,1
"Maria é aventureira, mas as vezes ele parece ser vulnerável",1
Teresa sempre foi afável,1
Níger é maldoso,0
Euclides é disciplinado,1
Angelina sempre foi frívola,0
Berenice nunca foi perseverante,2
Caetano era carismático,1
Valentina é tanto esmerada quanto impostor,2
Ludgero é ganancioso,0
Liciniano era desenvolto,1
Lis é tanto amorosa quanto descomedida,2
Helena nunca foi preparada,2
Adalsino não é persistente nem desmazelado,2
Ícaro é maquiavélico,0
Júlia é tanto afável quanto desleal,2
Virgínia é tanto produtiva quanto descomedida,2
Aquira é decente,1
Agnes sempre foi intolerante,0
Lara sempre foi intransigente,0
Idário era empreendedor,1
Betina é tanto desenvolta quanto intolerante,2
"Nice é pacata, mas as vezes ele parece ser comodista",1
"mesmo que as vezes Helena é otimista, Helena é muito bruta",0
Clarisse sempre foi chata,0
"Valentim parece ser cavalheiro, mas eu não sei",2
Maitê nunca foi desleal,2
"Renato parece ser agressivo, mas eu não sei",2
Adélia sempre foi feliz,1
Dejalme é paciente,1
Rosário não é preocupado nem despótico,2
Ladislau era imprudente,0
"mesmo que as vezes Taís é adorável, Taís é muito irrascível",0
"mesmo que as vezes Paula é nobre, Paula é muito debochada",0
Geórgia sempre foi aplicada,1
Noel era fraco,0
Manassés é transparente,1
Florentino é pessimista,0
Lucas é indiferente,0
Catarina é tanto autêntica quanto presunçosa,2
"Heraldo parece ser mentiroso, mas eu não sei",2
Baqui é corajoso,1
Lívia sempre foi proativa,1
Lisandro era imparcial,1
Nélson é hipócrita,0
Úrsula sempre foi impostor,0
Sofia nunca foi inconveniente,2
Conrado não é tolerante nem fútil,2
Canto é negligente,0
Jorge era descontraído,1
"mesmo que as vezes Betina é habilidosa, Betina é muito desleal",0
"mesmo que as vezes Virgínia é humanitária, Virgínia é muito fraca",0
Afonso era dissimulado,0
Amália é tanto civilizada quanto insensata,2
"mesmo que as vezes Úrsula é amigável, Úrsula é muito oportunista",0
Madu é fraco,0
Geórgia nunca foi prestável,2
Lis é tanto modesta quanto malandra,2
Júlio não é ousado nem desordeiro,2
Evandro não é modesto nem desbocado,2
Amanda é tanto paciente quanto relapsa,2
Bernardim era engraçado,1
Agnes nunca foi perfeccionista,2
Indro é paciente,1
Ítalo era injusto,0
Lótus é indecoroso,0
Balbino é apático,0
Sidónio não é aventureiro nem agressivo,2
Leónidas era divertido,1
"Elisa é racional, mas as vezes ele parece ser indelicada",1
Rodrigo era esplêndido,1
Zarão não é sensato nem distraído,2
"Amâncio parece ser empático, mas eu não sei",2
Ivo era interesseiro,0
Dinis era amoroso,1
Pilar nunca foi imponderada,2
Édipo era encantador,1
Taís nunca foi comunicativa,2
Irmino não é cavalheiro nem ignorante,2
Ravi era manhoso,0
Teodora sempre foi cruel,0
Abílio é criativo,1
Santana é leal,1
Maitê é tanto responsável quanto preconceituosa,2
Saladino é casmurro,0
Lara nunca foi idônea,2
Celino era exigente,0
Sertório não é cívico nem odioso,2
Élton era discriminador,0
"Nói parece ser negligente, mas eu não sei",2
Betina sempre foi conscienciosa,1
Cecília sempre foi empenhada,1
Berenice sempre foi insuportável,0
Agnes sempre foi companheira,1
"Laura é ousada, mas as vezes ele parece ser estourada",1
"Heriberto parece ser distraído, mas eu não sei",2
Geórgia sempre foi preparada,1
Clarisse é tanto credível quanto trapaceira,2
"mesmo que as vezes Teresa é esforçada, Teresa é muito injusta",0
"Angelina é justa, mas as vezes ele parece ser rabugenta",1
Dora sempre foi introvertida,0
Adélia sempre foi ansiosa,0
Oseas era persistente,1
Isabela é tanto maravilhosa quanto descomedida,2
Doralice nunca foi nervosa,2
Dinarte era cuidadoso,1
Ralfe não é esperançoso nem impaciente,2
Lis sempre foi incompetente,0
"mesmo que as vezes Aurora é sensata, Aurora é muito descomedida",0
Abraão é depressivo,0
"Primitivo parece ser agradável, mas eu não sei",2
Marília sempre foi arrogante,0
Betina sempre foi odiosa,0
Hirondino era sábio,1
Tadeu era instável,0
Willy é cavalheiro,1
Aventino é arrogante,0
Lívia nunca foi otimista,2
Lara é tanto proativa quanto rancorosa,2
Acilino é discriminador,0
"Berenice é dedicada, mas as vezes ele parece ser trapaceira",1
"mesmo que as vezes Lis é altruísta, Lis é muito ansiosa",0
Dora sempre foi impiedosa,0
Átila é caritativo,1
Amália sempre foi impulsiva,0
Zacarias é impostor,0
Turgo não é cavalheiro nem apático,2
Guilhermina é tanto esplêndida quanto descarada,2
Helena é tanto confiante quanto inconveniente,2
Berenice sempre foi sensata,1
Nicole sempre foi insensata,0
Ginestal era paciente,1
Eurico não é extraordinário nem ignorante,2
Leonora sempre foi colérica,0
Ermitério não é benévolo nem egoísta,2
Benício era transparente,1
"Nina é sincera, mas as vezes ele parece ser depressiva",1
"Arquimínio parece ser narcisista, mas eu não sei",2
Bernardim era carinhoso,1
Válter é esmerado,1
Laura sempre foi desmazelada,0
Adalberto era narcisista,0
Liberto não é alegre nem ansioso,2
Jordano não é adorável nem maquiavélico,2
Paloma sempre foi extraordinária,1
"Carolina é alegre, mas as vezes ele parece ser indecisa",1
Bárbaro era introvertido,0
Taís sempre foi sedentária,0
"mesmo que as vezes Elis é amorosa, Elis é muito distraída",0
"Clara é atenciosa, mas as vezes ele parece ser irracional",1
"Maitê é altruísta, mas as vezes ele parece ser distraída",1
Amanda sempre foi diligente,1
"Olímpio parece ser bisbilhoteiro, mas eu não sei",2
Beatriz sempre foi rigorosa,0
"Cursino parece ser cínico, mas eu não sei",2
Rúben é nobre,1
"Aurora é honrada, mas as vezes ele parece ser rigorosa",1
Alan é cordial,1
Sílvio era otimista,1
Hemetério é ajuizado,1
"mesmo que as vezes Maitê é afetiva, Maitê é muito tímida",0
"Taciano parece ser idôneo, mas eu não sei",2
Beto era interesseiro,0
Pilar é tanto atenciosa quanto antissocial,2
Vasco era consciencioso,1
Ana é tanto esperançosa quanto preguiçosa,2
Isabela é tanto cordial quanto introvertida,2
Sofia sempre foi meiga,1
Alberico era bruto,0
"mesmo que as vezes Leonora é natural, Leonora é muito incorreta",0
Paula nunca foi afável,2
Ginestal é fingido,0
"Sara é persistente, mas as vezes ele parece ser intolerante",1
Guarani era interesseiro,0
Oseias é ansioso,0
Zaido é insuportável,0
Luzio não é amigável nem comodista,2
Estélio é perspicaz,1
Helena é tanto esforçada quanto autoritária,2
Júlia sempre foi simpática,1
Anabela sempre foi malandra,0
Clemêncio não é cívico nem desmazelado,2
Eliseu é ousado,1
Leal é perseverante,1
"Lucas parece ser indelicado, mas eu não sei",2
Agnes sempre foi inconveniente,0
Gumesindo é atrevido,0
"Teodomiro parece ser doce, mas eu não sei",2
Dilan era irrequieto,0
Hólger era atrevido,0
"Maitê é livre , mas as vezes ele parece ser discriminador",1
Aurora sempre foi perfeccionista,1
Justiniano era egoísta,0
Azélio era humilde,1
Eunice sempre foi fraca,0
Rómulo é ciumento,0
Artur era comunicativo,1
Romário era empreendedor,1
"mesmo que as vezes Laura é valorosa, Laura é muito desumana",0
Décimo era desequilibrado,0
"Adauto parece ser prudente, mas eu não sei",2
Lis sempre foi introvertida,0
"mesmo que as vezes Júlia é amável, Júlia é muito vaidosa",0
Elzo era traidor,0
Micael não é íntegro nem impertinente,2
Gisela sempre foi afetiva,1
Ingo é nervoso,0
Elisa nunca foi fingida,2
Cecília nunca foi meiga,2
Sara sempre foi proativa,1
Amanda nunca foi sarcástica,2
Henoch não é forte nem fútil,2
Amália sempre foi forte,1
Eduardo é pessimista,0
Nicole nunca foi preparada,2
Heloísa sempre foi cordial,1
"Nice é tranquila, mas as vezes ele parece ser discriminador",1
Guildo era consciencioso,1
Júlia nunca foi ansiosa,2
Gervásio não é otimista nem inflexível,2
Carmim é preparado,1
Olívia sempre foi relapsa,0
"Virgínia é amável, mas as vezes ele parece ser cruel",1
"Estela é encantador, mas as vezes ele parece ser maliciosa",1
"Heloísa é forte, mas as vezes ele parece ser infiel",1
Berenice é tanto legal quanto desonesta,2
"Filino parece ser esperançoso, mas eu não sei",2
"mesmo que as vezes Isabela é comunicativa, Isabela é muito impulsiva",0
Alice é tanto assertiva quanto neurótica,2
Elis nunca foi descontraída,2
"mesmo que as vezes Maria é verdadeira, Maria é muito cruel",0
Mariana sempre foi exigente,0
"mesmo que as vezes Nina é calma, Nina é muito agressiva",0
Dora sempre foi antissocial,0
"mesmo que as vezes Clara é engraçada, Clara é muito grosseira",0
"Daniel parece ser bruto, mas eu não sei",2
Geórgia sempre foi inovador,1
Júlia sempre foi autoritária,0
"Taís é inteligente, mas as vezes ele parece ser falsa",1
Dora é tanto fiel quanto cruel,2
"mesmo que as vezes Isadora é conscienciosa, Isadora é muito instável",0
Evelácio é imprudente,0
Mélvin é sedentário,0
Duílio não é cívico nem cínico,2
Laertes é perfeccionista,1
Maitê sempre foi esmerada,1
"Quim parece ser modesto, mas eu não sei",2
"Alarico parece ser indiferente, mas eu não sei",2
Sara sempre foi maldosa,0
"mesmo que as vezes Guilhermina é madura, Guilhermina é muito obcecada",0
Aureliano era prestável,1
Nonato é vaidoso,0
"Armelim parece ser ganancioso, mas eu não sei",2
Lécio não é cavalheiro nem negligente,2
Judas é exigente,0
Amanda nunca foi esperançosa,2
Marinho é desenvolto,1
Tristão era egoísta,0
Cosme é vulnerável,0
Arnaldo era fraco,0
Agnes nunca foi teimosa,2
Sara sempre foi avarenta,0
Cosme é autêntico,1
"Luísa é genuína, mas as vezes ele parece ser desleal",1
Jamim era preguiçoso,0
"Dante parece ser desbocado, mas eu não sei",2
Orestes era disponível,1
"Luísa é perseverante, mas as vezes ele parece ser desumana",1
Noame é sincero,1
Guilhermina nunca foi criativa,2
Nice nunca foi sossegada,2
Hildeberto é avarento,0
Camilo era pedante,0
Aldaír era responsável,1
Isabela nunca foi irracional,2
Sadrudine é cínico,0
Estela sempre foi autêntica,1
Osmano é ousado,1
Anastácio era antissocial,0
Leonora é tanto tolerante quanto nervosa,2
Sansão era desmotivado,0
"mesmo que as vezes Luísa é responsável, Luísa é muito mentirosa",0
"Zared parece ser debochado, mas eu não sei",2
Vital não é ponderado nem rancoroso,2
Anabela é tanto imparcial quanto desmotivada,2
Doralice sempre foi sedentária,0
Deivid não é decente nem autoritário,2
Iúri não é habilidoso nem impaciente,2
Leonora nunca foi cordial,2
"Belisário parece ser imparcial, mas eu não sei",2
Clara nunca foi calma,2
Ademir não é comunicativo nem ignorante,2
Tadeu era frívolo,0
Venceslau era desafiador,0
Aldónio é bacana,1
Silvério não é consciencioso nem tímido,2
Teresa nunca foi humanitária,2
Fausto não é brioso nem falso,2
Lícidas é irritadiço,0
Nicole sempre foi produtiva,1
Absalão era amoroso,1
Ambrósio era companheiro,1
"Ana é desenvolta, mas as vezes ele parece ser irrascível",1
Beatriz é tanto briosa quanto calculista,2
Urbano não é prudente nem apressado,2
Agnes nunca foi birrenta,2
"mesmo que as vezes Paula é imparcial, Paula é muito irracional",0
"Teotónio parece ser inconstante, mas eu não sei",2
Elisa sempre foi rigorosa,0
Omar é discriminador,0
Sofia nunca foi desenvolta,2
Eduíno não é diligente nem possessivo,2
Cecília nunca foi eloquente,2
Liberal era confiável,1
"Hugo parece ser desumano, mas eu não sei",2
Nero é simpático,1
Garcia era insensato,0
Leão era malicioso,0
Salvador é tolerante,1
Armandino não é inventivo nem sarcástico,2
"Júlia é respeitador, mas as vezes ele parece ser desafiador",1
"Virgínia é persistente, mas as vezes ele parece ser estressada",1
Lénio é perseverante,1
"mesmo que as vezes Antonela é imparcial, Antonela é muito possessiva",0
Nina sempre foi ponderada,1
Heldemaro é tendencioso,0
Vladimiro era digno,1
Marílio era afetivo,1
Lívia sempre foi trocista,0
"Amanda é companheira, mas as vezes ele parece ser introvertida",1
"Salazar parece ser assertivo, mas eu não sei",2
"Amanda é prudente, mas as vezes ele parece ser desafiador",1
Herculano era impostor,0
Mirco é covarde,0
Dagmar é maravilhoso,1
Arquimedes era desmotivado,0
Claro era valente,1
Lis nunca foi rigorosa,2
Eunice sempre foi xenófoba,0
Dilermando é chato,0
Apolinário é empreendedor,1
Rúpio é rigoroso,0
"Inocêncio parece ser odioso, mas eu não sei",2
Olívia nunca foi aventureira,2
Amarílio era extrovertido,1
"Idelso parece ser cordial, mas eu não sei",2
Arménio era bacana,1
"Nina é cívica, mas as vezes ele parece ser pessimista",1
Franco não é amoroso nem incompetente,2
Abrão é arrogante,0
Leonora nunca foi perseverante,2
Sofia sempre foi afável,1
"mesmo que as vezes Anabela é bacana, Anabela é muito imponderada",0
"Idálio parece ser esforçado, mas eu não sei",2
"Júlia é observador, mas as vezes ele parece ser tendenciosa",1
Júlia sempre foi esforçada,1
Isadora nunca foi depressiva,2
Olívia sempre foi falsa,0
Beatriz nunca foi cordial,2
Júnio era honrado,1
"Sara é observador, mas as vezes ele parece ser desordeira",1
Taís sempre foi desonesta,0
Donzílio é carismático,1
Djalme é otimista,1
Luísa sempre foi grosseira,0
"Jório parece ser curioso, mas eu não sei",2
Donaldo não é pacato nem cínico,2
Afrânio é indelicado,0
Beatriz sempre foi independente,1
Rolim é carinhoso,1
"Elisa é confiável, mas as vezes ele parece ser imprudente",1
Teresa é tanto prestativa quanto orgulhosa,2
Úrsula sempre foi racional,1
Dácio era debochado,0
"mesmo que as vezes Amanda é fofa, Amanda é muito indecisa",0
"mesmo que as vezes Sara é forte, Sara é muito fútil",0
"Elisa é inovador, mas as vezes ele parece ser desbocada",1
Indro era indeciso,0
Mirela é tanto gentil quanto desmotivada,2
Isabela é tanto sensível quanto desleal,2
Sixto é sensível,1
Estela sempre foi exigente,0
Aquila é xenófobo,0
Sifredo era introvertido,0
Elis é tanto pacata quanto avarenta,2
Helena sempre foi humilde,1
Hirondino é maravilhoso,1
Antonela sempre foi disciplinada,1
Aramis é inteligente,1
Eustácio era pessimista,0
Catarina sempre foi transparente,1
Emílio era aplicado,1
"Angelina é perspicaz, mas as vezes ele parece ser oportunista",1
Georgino é inovador,1
Paloma sempre foi ternurenta,1
Guilhermino é valente,1
Eden não é disciplinado nem pedante,2
Betina nunca foi quezilenta,2
Ademir é incorreto,0
Berenice sempre foi pessimista,0
Virgínia sempre foi odiosa,0
Hildebrando é doce,1
"Elis é decente, mas as vezes ele parece ser nervosa",1
"Salma parece ser proativo, mas eu não sei",2
"Valentina é fiel, mas as vezes ele parece ser descortês",1
"mesmo que as vezes Catarina é natural, Catarina é muito desleal",0
Eunice nunca foi cortês,2
Teodósio era rabugento,0
Mélvin era genuíno,1
Dimas era entusiasta,1
Clóvis é genuíno,1
Vitorino é extrovertido,1
Micael de Jesus era presunçoso,0
Adail é inconveniente,0
Raimundo era bondoso,1
Isabela é tanto atenciosa quanto maquiavélica,2
Paloma é tanto sagaz quanto instável,2
Maitê sempre foi estourada,0
Custódio não é proativo nem inconstante,2
Santana era debochado,0
"mesmo que as vezes Agnes é sagaz, Agnes é muito traidor",0
Antonela é tanto nobre quanto desbocada,2
"Mariana é idônea, mas as vezes ele parece ser inconveniente",1
Domingos não é altruísta nem desafiador,2
Lutero é incorreto,0
Agnes é tanto perspicaz quanto manhosa,2
Graciliano é benévolo,1
"mesmo que as vezes Guilhermina é afetiva, Guilhermina é muito atrevida",0
